{
	"$schema": "http://json-schema.org/draft-07/schema#",
	"title": "Invalidacion de Documento Tributario Electronico",
	"type": "object",
	"properties": {
		"identificacion": {
			"description": "Informacion de identificacion de Invalidacion",
			"type": "object",
			"properties": {
				"version": {
					"type": "integer",
					"description": "Version del esquema",
					"const": 2
				},
				"ambiente": {
					"type": "string",
					"description": "Ambiente de destino: 00 - Pruebas, 01 - Produccion",
					"enum": ["00", "01"]
				},
				"codigoGeneracion": {
					"type": "string",
					"description": "Codigo Generacion",
					"maxLength": 36,
					"minLength": 36,
					"pattern": "^[A-F0-9]{8}-[A-F0-9]{4}-[A-F0-9]{4}-[A-F0-9]{4}-[A-F0-9]{12}$"
				},
				"fecAnula": {
					"type": "string",
					"description": "Fecha de invalidacion (formato yyyy-mm-dd)",
					"format": "date"
				},
				"horAnula": {
					"type": "string",
					"description": "Hora de invalidacion",
					"pattern": "^(0[0-9]|1[0-9]|2[0-3]):[0-5][0-9]:[0-5][0-9]?$"
				}
			},
			"additionalProperties": false,
			"required": ["version", "ambiente", "codigoGeneracion", "fecAnula", "horAnula"]
		},
		"emisor": {
			"description": "Datos del emisor",
			"type": "object",
			"properties": {
				"nit": {
					"description": "NIT, sin guiones",
					"type": "string",
					"pattern": "^([0-9]{14}|[0-9]{9})$"
				},
				"nombre": {
					"type": "string",
					"description": "Nombre/Denominacion/Razon social",
					"maxLength": 250,
					"minLength": 3
				},
				"tipoEstablecimiento": {
					"type": "string",
					"description": "Tipo establecimiento donde se emite documento",
					"enum": ["01", "02", "04", "07", "20"]
				},
				"nomEstablecimiento": {
					"description": "Nombre de establecimiento",
					"type": ["string", "null"],
					"maxLength": 150,
					"minLength": 3
				},
				"codEstableMH": {
					"description": "Codigo, Numero o Identificador de establecimiento por MH",
					"type": [
						"string",
						"null"
					],
					"maxLength": 4,
					"minLength": 4
				},
				"codEstable": {
					"description": "Codigo, Numero o Identificador de establecimiento por Contribuyente",
					"type": [
						"string",
						"null"
					],
					"minLength": 1,
					"maxLength": 10
				},
				"codPuntoVentaMH": {
					"description": "Codigo, Numero o Identificador de punto de venta por MH",
					"type": [
						"string",
						"null"
					],
					"maxLength": 4,
					"minLength": 4
				},
				"codPuntoVenta": {
					"description": "Codigo, Numero o Identificador de punto de venta por Contribuyente",
					"type": [
						"string",
						"null"
					],
					"maxLength": 15,
					"minLength": 1
				},
				"telefono": {
					"type": ["string", "null"],
					"description": "Numero de telefono del emisor",
					"minLength": 8,
					"maxLength": 26,
					"pattern": "^[0-9+;]{8,26}$"
				},
				"correo": {
					"type": "string",
					"description": "Correo electronico del emisor",
					"format": "email",
					"maxLength": 100,
					"minLength": 3
				}
			},
			"additionalProperties": false,
			"required": ["nit", "nombre", "tipoEstablecimiento", "telefono", "correo", "codEstable", "codPuntoVenta", "nomEstablecimiento"]
		},
		"documento": {
			"description": "Datos del documento a Invalidar",
			"type": "object",
			"properties": {
				"tipoDte": {
					"type": "string",
					"description": "Tipo de documento",
					"pattern": "^0[0-9]|1[0-5]$",
					"enum": ["01",
						"03",
						"04",
						"05",
						"06",
						"07",
						"08",
						"09",
						"10",
						"11",
						"14",
						"15"
					]
				},
				"codigoGeneracion": {
					"type": "string",
					"description": "Codigo Generacion",
					"maxLength": 36,
					"minLength": 36,
					"pattern": "^[A-F0-9]{8}-[A-F0-9]{4}-[A-F0-9]{4}-[A-F0-9]{4}-[A-F0-9]{12}$"
				},
				"selloRecibido": {
					"type": "string",
					"description": "Sello de recepcion",
					"maxLength": 40,
					"minLength": 40,
					"pattern": "^[A-Z0-9]{40}$"
				},
				"numeroControl": {
					"type": "string",
					"description": "Numero control",
                                        "maxLength": 34,
                                        "minLength": 34,
                                        "pattern": "^DTE-0[0-9]|1[0-2]-[A-Z0-9]{8}-[0-9]{18}$"
				},
				"fecEmi": {
					"type": "string",
					"description": "Fecha de emision (formato yyyy-mm-dd)",
					"format": "date"
				},
				"montoIva": {
					"type": ["number", "null"],
					"description": "Monto IVA",
					"minimum": 0,
					"exclusiveMaximum": 100000000000,
					"multipleOf": 0.01
				},
				"codigoGeneracionR": {
					"type": ["string", "null"],
					"description": "Codigo Generacion que reemplaza",
					"maxLength": 36,
					"minLength": 36,
					"pattern": "^[A-F0-9]{8}-[A-F0-9]{4}-[A-F0-9]{4}-[A-F0-9]{4}-[A-F0-9]{12}$"
				},
				"tipoDocumento": {
					"type": "string",
					"description": "Tipo documento de identificación CAT-22: 36 - NIT, 13 - DUI, 02 - Carnet de residente, 03 - PASAPORTE, 37 - OTRO",
					"enum": ["36", "13", "02", "03", "37"]
				},
				"numDocumento": {
					"type": "string",
					"description": "Número de documento de Identificación ",
					"minLength": 3,
					"maxLength": 20
				},
				"nombre": {
					"type": "string",
					"description": "Nombre/Denominacion/Razon social",
					"maxLength": 200,
					"minLength": 5
				},
				"telefono": {
					"type": ["string", "null"],
					"description": "Numero de telefono del receptor",
					"minLength": 8,
					"maxLength": 50,
					"pattern": "^[0-9+;]{8,50}$"
				},
				"correo": {
					"type": "string",
					"description": "Correo electronico del receptor",
					"format": "email",
					"maxLength": 100
				}
			},
			"additionalProperties": false,
			"required": ["tipoDte", "codigoGeneracion", "selloRecibido", "numeroControl", "fecEmi", "montoIva", "codigoGeneracionR", "tipoDocumento", "numDocumento", "nombre"]
		},
		"motivo": {
			"description": "Datos del motivo de Invalidacion",
			"type": "object",
			"properties": {
				"tipoAnulacion": {
					"type": "integer",
					"description": "Tipo de invalidacion",
					"enum": [1, 2, 3]
				},
				"motivoAnulacion": {
					"type": ["string", "null"],
					"description": "Motivo de invalidacion",
					"maxLength": 250,
					"minLength": 5
				},
				"nombreResponsable": {
					"description": "Nombre de la persona responsable de invalidar el DTE",
					"type": "string",
					"maxLength": 100,
					"minLength": 5
				},
				"tipDocResponsable": {
					"type": "string",
					"description": "Tipo documento de identificación CAT-22: 36 - NIT, 13 - DUI, 02 - Carnet de residente, 03 - PASAPORTE, 37 - OTRO",
					"enum": ["36", "13", "02", "03", "37"]
				},
				"numDocResponsable": {
					"type": "string",
					"description": "Número de documento de identificación ",
					"minLength": 3,
					"maxLength": 20
				},
				"nombreSolicita": {
					"description": "Nombre de la persona que solicita invalidar el DTE",
					"type": "string",
					"maxLength": 100,
					"minLength": 5
				},
				"tipDocSolicita": {
					"type": "string",
					"description": "Tipo documento de identificación solicitante CAT-22: 36 - NIT, 13 - DUI, 02 - Carnet de residente, 03 - PASAPORTE, 37 - OTRO",
					"enum": ["36", "13", "02", "03", "37"]
				},
				"numDocSolicita": {
					"type": "string",
					"description": "Número de documento de identificación solicitante.",
					"minLength": 3,
					"maxLength": 20
				}
			},
			"allOf": [{
				"if": {
					"properties": {
						"tipoAnulacion": {
							"const": 3
						}
					}
				},
				"then": {
					"properties": {
						"motivoAnulacion": {
							"type": "string"
						}
					}
				}
			}],
			"additionalProperties": false,
			"required": ["tipoAnulacion", "motivoAnulacion", "nombreResponsable", "tipDocResponsable", "numDocResponsable", "nombreSolicita", "tipDocSolicita", "numDocSolicita"]
		}
	},
	"allOf": [{
		"if": {
			"properties": {
				"motivo": {
					"properties": {
						"tipoAnulacion": {
							"const": 2
						}
					}
				}
			}
		},
		"then": {
			"properties": {
				"documento": {
					"properties": {
						"codigoGeneracionR": {
							"type": "null"
						}
					}
				}
			}
		},
		"else": {
			"properties": {
				"documento": {
					"properties": {
						"codigoGeneracionR": {
							"type": "string"
						}
					}
				}
			}
		}
	}],
	"additionalProperties": false,
	"required": ["identificacion", "emisor", "documento", "motivo"]
}