{
  "documento": {
    "codigoGeneracion": "C1641927-90E3-4F13-8C65-13E89EF1C105",
    "codigoGeneracionR": null,
    "correo": "cliente1@demo.com",
    "fecEmi": "2025-09-16",
    "montoIva": 1.73,
    "nombre": "ariel",
    "numDocumento": "13240304791012",
    "numeroControl": "DTE-03-S001P001-000000000000195",
    "selloRecibido": "20258C75DA40DA054FE595DB46E815312013PYHZ",
    "telefono": "74154027",
    "tipoDocumento": "36",
    "tipoDte": "03"
  },
  "emisor": {
    "codEstable": "0001",
    "codEstableMH": "0001",
    "codPuntoVenta": "0001",
    "codPuntoVentaMH": "0001",
    "correo": "farmaciasantacatalina7@gmail.com",
    "nit": "09061712791014",
    "nomEstablecimiento": "Farmacia Santa Catalina",
    "nombre": "Karol Yamileth Cruz Escobar",
    "telefono": "22223456",
    "tipoEstablecimiento": "01"
  },
  "identificacion": {
    "ambiente": "00",
    "codigoGeneracion": "99356A7A-8AE2-4A2E-BFBE-6A0F2A49CFCE",
    "fecAnula": "2025-09-16",
    "horAnula": "20:01:00",
    "version": 2
  },
  "motivo": {
    "motivoAnulacion": "koluftn",
    "nombreResponsable": "Karol Yamileth Cruz Escobar",
    "nombreSolicita": "ariel",
    "numDocResponsable": "09061712791014",
    "numDocSolicita": "13240304791012",
    "tipDocResponsable": "36",
    "tipDocSolicita": "36",
    "tipoAnulacion": 2
  }
}
