{
  "documento": {
    "codigoGeneracion": "0710AB54-4FA3-4C20-B57A-3E29B50E51B7",
    "codigoGeneracionR": null,
    "correo": "cliente1@demo.com",
    "fecEmi": "2025-09-16",
    "montoIva": 1.5,
    "nombre": "ariel",
    "numDocumento": "13240304791012",
    "numeroControl": "DTE-03-S001P001-000000000000194",
    "selloRecibido": "20255D8C8F2156CA4B4D966E27D70B0FB48AEPIE",
    "telefono": "74154027",
    "tipoDocumento": "36",
    "tipoDte": "03"
  },
  "emisor": {
    "codEstable": "0001",
    "codEstableMH": "0001",
    "codPuntoVenta": "0001",
    "codPuntoVentaMH": "0001",
    "correo": "farmaciasantacatalina7@gmail.com",
    "nit": "09061712791014",
    "nomEstablecimiento": "Farmacia Santa Catalina",
    "nombre": "Karol Yamileth Cruz Escobar",
    "telefono": "22223456",
    "tipoEstablecimiento": "01"
  },
  "identificacion": {
    "ambiente": "00",
    "codigoGeneracion": "2D28E3CD-5E83-4B45-9A34-C00C57843E73",
    "fecAnula": "2025-09-16",
    "horAnula": "17:06:21",
    "version": 2
  },
  "motivo": {
    "motivoAnulacion": "devolucion",
    "nombreResponsable": "Karol Yamileth Cruz Escobar",
    "nombreSolicita": "ariel",
    "numDocResponsable": "09061712791014",
    "numDocSolicita": "13240304791012",
    "tipDocResponsable": "36",
    "tipDocSolicita": "36",
    "tipoAnulacion": 2
  }
}
